{
  "$schema": "http://json-schema.org/draft-07/schema#",
  "$id": "https://freshlybaked.us/lp/schemas/policy.v1.schema.json",
  "title": "Landing-page selection policy (policy.json) v1",
  "description": "Declarative, Helios-authored, locally-evaluated selection policy (parent EPIC_PLAN §6). Output biases the per-NUM weighting on the canonical /SITE/PURPOSE/SLUG/NUM schema; it never emits a new URL shape. The evaluator must be free of impure nondeterminism (CEL, no eval); randomized scatter is supplied as a deterministic HMAC bucket input.",
  "type": "object",
  "additionalProperties": false,
  "required": ["schema", "policy_version_id", "selection_algorithm_version", "rules"],
  "properties": {
    "schema": { "const": "freshlybaked.lp.policy.v1" },
    "policy_version_id": { "type": "string", "minLength": 1 },
    "selection_algorithm_version": {
      "type": "string",
      "minLength": 1,
      "description": "Logged on every event so off-policy/propensity estimates stay comparable (parent §6/§8)."
    },
    "rules": {
      "type": "array",
      "minItems": 1,
      "items": { "$ref": "#/definitions/rule" }
    }
  },
  "definitions": {
    "rule": {
      "type": "object",
      "additionalProperties": false,
      "required": ["policy_rule_id", "match", "assignment_key", "experiment_id", "experiment_salt", "exploration_rate_bps", "slots"],
      "properties": {
        "policy_rule_id": { "type": "string", "minLength": 1 },
        "match": {
          "type": "object",
          "description": "Context predicate. At least one of site/family/cluster_slug must be present.",
          "minProperties": 1,
          "properties": {
            "site": { "type": "string" },
            "family": { "type": "string" },
            "cluster_slug": { "type": "string" }
          },
          "additionalProperties": true
        },
        "assignment_key": {
          "type": "array",
          "description": "Ordered context fields that compose the per-click assignment key fed to the HMAC bucket (parent §6).",
          "minItems": 1,
          "items": { "type": "string" }
        },
        "experiment_id": {
          "type": "string",
          "minLength": 1,
          "description": "Stable experiment identity. experiment_salt is tied to this, NOT to bundle_id, so routine republishes do not reshuffle in-flight clicks."
        },
        "experiment_salt": { "type": "string", "minLength": 1 },
        "exploration_rate_bps": {
          "type": "integer",
          "minimum": 0,
          "maximum": 10000,
          "description": "Fraction (basis points) of clicks routed to the explore set vs. the exploit champion."
        },
        "slots": {
          "type": "object",
          "description": "Keyed by slot id (X1, X2, ...). Each slot is exactly one of: exploit/explore (variant pick), fixed (frozen component), or data_source (data-driven, e.g. Sweed).",
          "minProperties": 1,
          "additionalProperties": { "$ref": "#/definitions/slot" }
        }
      }
    },
    "slot": {
      "type": "object",
      "oneOf": [
        {
          "additionalProperties": false,
          "required": ["exploit"],
          "properties": {
            "exploit": { "type": "string", "minLength": 1, "description": "Champion variant id served outside the exploration fraction." },
            "explore": {
              "type": "array",
              "description": "Weighted exploration candidates. Empty/omitted = pure exploit.",
              "items": {
                "type": "object",
                "additionalProperties": false,
                "required": ["variant_id", "weight"],
                "properties": {
                  "variant_id": { "type": "string", "minLength": 1 },
                  "weight": { "type": "integer", "minimum": 0 }
                }
              }
            }
          }
        },
        {
          "additionalProperties": false,
          "required": ["fixed"],
          "properties": {
            "fixed": { "type": "string", "minLength": 1, "description": "Frozen component id (e.g. the X2 trust anchor)." }
          }
        },
        {
          "additionalProperties": false,
          "required": ["data_source", "config_id"],
          "properties": {
            "data_source": { "type": "string", "minLength": 1, "examples": ["sweed_menu"] },
            "config_id": { "type": "string", "minLength": 1 }
          }
        }
      ]
    }
  }
}
